{"meta":{"name":"Dubai Streets Guide road database","version":"1.0.0","generated":"2026-10-29","coordinateSystem":"WGS84","caveat":"Coordinates are approximate/schematic and exit numbers, gate numbers and lane data are driving aids, not an official source. Verify on the road and with RTA/JAFZA/ADNOC/ENOC/Emarat."},"roads":[{"id":"e11","name":"E11 Sheikh Zayed Road","ar":"شارع الشيخ زايد","type":"highway","limit":100,"coords":[[24.935,54.955],[24.93633,54.957],[24.93767,54.959],[24.939,54.961],[24.94033,54.963],[24.94167,54.965],[24.943,54.967],[24.94433,54.969],[24.94567,54.971],[24.947,54.973],[24.94833,54.975],[24.94967,54.977],[24.951,54.979],[24.95233,54.981],[24.95367,54.983],[24.955,54.985],[24.95633,54.987],[24.95767,54.989],[24.959,54.991],[24.96033,54.993],[24.96167,54.995],[24.963,54.997],[24.96433,54.999],[24.96567,55.001],[24.967,55.003],[24.96833,55.005],[24.96967,55.007],[24.971,55.009],[24.97233,55.011],[24.97367,55.013],[24.975,55.015],[24.97619,55.01714],[24.97738,55.01929],[24.97857,55.02143],[24.97976,55.02357],[24.98095,55.02571],[24.98214,55.02786],[24.98333,55.03],[24.98452,55.03214],[24.98571,55.03429],[24.9869,55.03643],[24.9881,55.03857],[24.98929,55.04071],[24.99048,55.04286],[24.99167,55.045],[24.99286,55.04714],[24.99405,55.04929],[24.99524,55.05143],[24.99643,55.05357],[24.99762,55.05571],[24.99881,55.05786],[25.0,55.06],[25.00125,55.06219],[25.0025,55.06437],[25.00375,55.06656],[25.005,55.06875],[25.00625,55.07094],[25.0075,55.07313],[25.00875,55.07531],[25.01,55.0775],[25.01125,55.07969],[25.0125,55.08187],[25.01375,55.08406],[25.015,55.08625],[25.01625,55.08844],[25.0175,55.09063],[25.01875,55.09281],[25.02,55.095],[25.02167,55.09667],[25.02333,55.09833],[25.025,55.1],[25.02667,55.10167],[25.02833,55.10333],[25.03,55.105],[25.03167,55.10667],[25.03333,55.10833],[25.035,55.11],[25.03667,55.11167],[25.03833,55.11333],[25.04,55.115],[25.04167,55.11667],[25.04333,55.11833],[25.045,55.12],[25.04688,55.12156],[25.04875,55.12313],[25.05063,55.12469],[25.0525,55.12625],[25.05438,55.12781],[25.05625,55.12937],[25.05813,55.13094],[25.06,55.1325],[25.06188,55.13406],[25.06375,55.13563],[25.06563,55.13719],[25.0675,55.13875],[25.06938,55.14031],[25.07125,55.14187],[25.07313,55.14344],[25.075,55.145],[25.07658,55.14684],[25.07816,55.14868],[25.07974,55.15053],[25.08132,55.15237],[25.08289,55.15421],[25.08447,55.15605],[25.08605,55.15789],[25.08763,55.15974],[25.08921,55.16158],[25.09079,55.16342],[25.09237,55.16526],[25.09395,55.16711],[25.09553,55.16895],[25.09711,55.17079],[25.09868,55.17263],[25.10026,55.17447],[25.10184,55.17632],[25.10342,55.17816],[25.105,55.18],[25.10654,55.18192],[25.10808,55.18385],[25.10962,55.18577],[25.11115,55.18769],[25.11269,55.18962],[25.11423,55.19154],[25.11577,55.19346],[25.11731,55.19538],[25.11885,55.19731],[25.12038,55.19923],[25.12192,55.20115],[25.12346,55.20308],[25.125,55.205],[25.12674,55.20674],[25.12848,55.20848],[25.13022,55.21022],[25.13196,55.21196],[25.1337,55.2137],[25.13543,55.21543],[25.13717,55.21717],[25.13891,55.21891],[25.14065,55.22065],[25.14239,55.22239],[25.14413,55.22413],[25.14587,55.22587],[25.14761,55.22761],[25.14935,55.22935],[25.15109,55.23109],[25.15283,55.23283],[25.15457,55.23457],[25.1563,55.2363],[25.15804,55.23804],[25.15978,55.23978],[25.16152,55.24152],[25.16326,55.24326],[25.165,55.245],[25.16688,55.24659],[25.16876,55.24818],[25.17065,55.24976],[25.17253,55.25135],[25.17441,55.25294],[25.17629,55.25453],[25.17818,55.25612],[25.18006,55.25771],[25.18194,55.25929],[25.18382,55.26088],[25.18571,55.26247],[25.18759,55.26406],[25.18947,55.26565],[25.19135,55.26724],[25.19324,55.26882],[25.19512,55.27041],[25.197,55.272],[25.19903,55.27322],[25.20107,55.27443],[25.2031,55.27565],[25.20513,55.27687],[25.20717,55.27808],[25.2092,55.2793],[25.21123,55.28052],[25.21327,55.28173],[25.2153,55.28295],[25.21733,55.28417],[25.21937,55.28538],[25.2214,55.2866]],"note":"Jebel Ali border to Trade Centre. Limit varies 100–120."},{"id":"e311","name":"E311 Sheikh Mohammed Bin Zayed Rd","ar":"شارع الشيخ محمد بن زايد","type":"highway","limit":120,"coords":[[24.95,55.12],[24.95125,55.12214],[24.9525,55.12429],[24.95375,55.12643],[24.955,55.12857],[24.95625,55.13071],[24.9575,55.13286],[24.95875,55.135],[24.96,55.13714],[24.96125,55.13929],[24.9625,55.14143],[24.96375,55.14357],[24.965,55.14571],[24.96625,55.14786],[24.9675,55.15],[24.96875,55.15214],[24.97,55.15429],[24.97125,55.15643],[24.9725,55.15857],[24.97375,55.16071],[24.975,55.16286],[24.97625,55.165],[24.9775,55.16714],[24.97875,55.16929],[24.98,55.17143],[24.98125,55.17357],[24.9825,55.17571],[24.98375,55.17786],[24.985,55.18],[24.98632,55.18206],[24.98765,55.18412],[24.98897,55.18618],[24.99029,55.18824],[24.99162,55.19029],[24.99294,55.19235],[24.99426,55.19441],[24.99559,55.19647],[24.99691,55.19853],[24.99824,55.20059],[24.99956,55.20265],[25.00088,55.20471],[25.00221,55.20676],[25.00353,55.20882],[25.00485,55.21088],[25.00618,55.21294],[25.0075,55.215],[25.00882,55.21706],[25.01015,55.21912],[25.01147,55.22118],[25.01279,55.22324],[25.01412,55.22529],[25.01544,55.22735],[25.01676,55.22941],[25.01809,55.23147],[25.01941,55.23353],[25.02074,55.23559],[25.02206,55.23765],[25.02338,55.23971],[25.02471,55.24176],[25.02603,55.24382],[25.02735,55.24588],[25.02868,55.24794],[25.03,55.25],[25.03143,55.25196],[25.03286,55.25393],[25.03429,55.25589],[25.03571,55.25786],[25.03714,55.25982],[25.03857,55.26179],[25.04,55.26375],[25.04143,55.26571],[25.04286,55.26768],[25.04429,55.26964],[25.04571,55.27161],[25.04714,55.27357],[25.04857,55.27554],[25.05,55.2775],[25.05143,55.27946],[25.05286,55.28143],[25.05429,55.28339],[25.05571,55.28536],[25.05714,55.28732],[25.05857,55.28929],[25.06,55.29125],[25.06143,55.29321],[25.06286,55.29518],[25.06429,55.29714],[25.06571,55.29911],[25.06714,55.30107],[25.06857,55.30304],[25.07,55.305],[25.07161,55.30677],[25.07323,55.30855],[25.07484,55.31032],[25.07645,55.3121],[25.07806,55.31387],[25.07968,55.31565],[25.08129,55.31742],[25.0829,55.31919],[25.08452,55.32097],[25.08613,55.32274],[25.08774,55.32452],[25.08935,55.32629],[25.09097,55.32806],[25.09258,55.32984],[25.09419,55.33161],[25.09581,55.33339],[25.09742,55.33516],[25.09903,55.33694],[25.10065,55.33871],[25.10226,55.34048],[25.10387,55.34226],[25.10548,55.34403],[25.1071,55.34581],[25.10871,55.34758],[25.11032,55.34935],[25.11194,55.35113],[25.11355,55.3529],[25.11516,55.35468],[25.11677,55.35645],[25.11839,55.35823],[25.12,55.36],[25.12172,55.36172],[25.12345,55.36345],[25.12517,55.36517],[25.1269,55.3669],[25.12862,55.36862],[25.13034,55.37034],[25.13207,55.37207],[25.13379,55.37379],[25.13552,55.37552],[25.13724,55.37724],[25.13897,55.37897],[25.14069,55.38069],[25.14241,55.38241],[25.14414,55.38414],[25.14586,55.38586],[25.14759,55.38759],[25.14931,55.38931],[25.15103,55.39103],[25.15276,55.39276],[25.15448,55.39448],[25.15621,55.39621],[25.15793,55.39793],[25.15966,55.39966],[25.16138,55.40138],[25.1631,55.4031],[25.16483,55.40483],[25.16655,55.40655],[25.16828,55.40828],[25.17,55.41],[25.1715,55.412],[25.173,55.414],[25.1745,55.416],[25.176,55.418],[25.1775,55.42],[25.179,55.422],[25.1805,55.424],[25.182,55.426],[25.1835,55.428],[25.185,55.43],[25.1865,55.432],[25.188,55.434],[25.1895,55.436],[25.191,55.438],[25.1925,55.44],[25.194,55.442],[25.1955,55.444],[25.197,55.446],[25.1985,55.448],[25.2,55.45]],"note":"Heavy-truck lane rules apply."},{"id":"e611","name":"E611 Emirates Road","ar":"شارع الإمارات","type":"highway","limit":120,"coords":[[24.88,55.19],[24.88167,55.19167],[24.88333,55.19333],[24.885,55.195],[24.88667,55.19667],[24.88833,55.19833],[24.89,55.2],[24.89167,55.20167],[24.89333,55.20333],[24.895,55.205],[24.89667,55.20667],[24.89833,55.20833],[24.9,55.21],[24.90167,55.21167],[24.90333,55.21333],[24.905,55.215],[24.90667,55.21667],[24.90833,55.21833],[24.91,55.22],[24.91167,55.22167],[24.91333,55.22333],[24.915,55.225],[24.91667,55.22667],[24.91833,55.22833],[24.92,55.23],[24.92167,55.23167],[24.92333,55.23333],[24.925,55.235],[24.92667,55.23667],[24.92833,55.23833],[24.93,55.24],[24.93167,55.24167],[24.93333,55.24333],[24.935,55.245],[24.93667,55.24667],[24.93833,55.24833],[24.94,55.25],[24.94167,55.25167],[24.94333,55.25333],[24.945,55.255],[24.94667,55.25667],[24.94833,55.25833],[24.95,55.26],[24.95167,55.26167],[24.95333,55.26333],[24.955,55.265],[24.95667,55.26667],[24.95833,55.26833],[24.96,55.27],[24.96167,55.27167],[24.96333,55.27333],[24.965,55.275],[24.96667,55.27667],[24.96833,55.27833],[24.97,55.28],[24.97167,55.28167],[24.97333,55.28333],[24.975,55.285],[24.97667,55.28667],[24.97833,55.28833],[24.98,55.29],[24.98167,55.29167],[24.98333,55.29333],[24.985,55.295],[24.98667,55.29667],[24.98833,55.29833],[24.99,55.3],[24.99167,55.30167],[24.99333,55.30333],[24.995,55.305],[24.99667,55.30667],[24.99833,55.30833],[25.0,55.31],[25.00167,55.31167],[25.00333,55.31333],[25.005,55.315],[25.00667,55.31667],[25.00833,55.31833],[25.01,55.32],[25.01167,55.32167],[25.01333,55.32333],[25.015,55.325],[25.01667,55.32667],[25.01833,55.32833],[25.02,55.33],[25.02167,55.33167],[25.02333,55.33333],[25.025,55.335],[25.02667,55.33667],[25.02833,55.33833],[25.03,55.34],[25.03179,55.34154],[25.03359,55.34308],[25.03538,55.34462],[25.03718,55.34615],[25.03897,55.34769],[25.04077,55.34923],[25.04256,55.35077],[25.04436,55.35231],[25.04615,55.35385],[25.04795,55.35538],[25.04974,55.35692],[25.05154,55.35846],[25.05333,55.36],[25.05513,55.36154],[25.05692,55.36308],[25.05872,55.36462],[25.06051,55.36615],[25.06231,55.36769],[25.0641,55.36923],[25.0659,55.37077],[25.06769,55.37231],[25.06949,55.37385],[25.07128,55.37538],[25.07308,55.37692],[25.07487,55.37846],[25.07667,55.38],[25.07846,55.38154],[25.08026,55.38308],[25.08205,55.38462],[25.08385,55.38615],[25.08564,55.38769],[25.08744,55.38923],[25.08923,55.39077],[25.09103,55.39231],[25.09282,55.39385],[25.09462,55.39538],[25.09641,55.39692],[25.09821,55.39846],[25.1,55.4],[25.10156,55.40187],[25.10313,55.40375],[25.10469,55.40563],[25.10625